{
  "counts": {
    "commits_per_token": 41421508.0,
    "lookups_per_token": 41311910.0,
    "native_ops_att_per_ctx": 4128768.0,
    "native_ops_lin": 811698487296.0,
    "scores_per_token_per_ctx": 8064.0,
    "table_rows": 4992335872.0
  },
  "estimates": [
    {
      "commitments_per_row": 20,
      "gadget": "RsqrtRow",
      "lookups_per_row": 30,
      "why": "RFC-0009 states RsqrtRow's cost approximately until its limbs are fixed (#118)"
    }
  ],
  "lowering": {
    "max_log2_rows": 32,
    "positions": 16,
    "stages": 3
  },
  "model": {
    "d_ff": 53248,
    "d_head": 128,
    "d_model": 16384,
    "n_heads": 128,
    "n_kv_heads": 8,
    "n_layers": 126,
    "parameters": 405849243648,
    "profile": "servable",
    "vocab": 128256
  },
  "multiplicities": {
    "excludes": "the range tables of SoftmaxRow's and RsqrtRow's checks, which the selection does not allocate yet (#118, #122)",
    "total": 4992335872
  },
  "per_layer_per_token": {
    "committed": {
      "lookup_outputs": 260096,
      "one_hot": 0,
      "row_scalars": 808,
      "split_limbs": 66560,
      "total": 327464
    },
    "lookups": 327612,
    "requantized": {
      "AttnNorm": 16384,
      "AttnOut": 16384,
      "AttnResidual": 16384,
      "MlpNorm": 16384,
      "MlpResidual": 16384,
      "Product": 53248,
      "RopeK": 1024,
      "RopeQ": 16384,
      "Silu": 53248,
      "Up": 53248,
      "V": 1024,
      "total": 260096
    }
  },
  "per_score": {
    "commitments": 1,
    "lookups": 1,
    "product_tree_leaves": 1,
    "scores_per_token_per_ctx": 8064.0
  },
  "per_token": {
    "committed": {
      "lookup_outputs": 32788480,
      "one_hot": 128256,
      "row_scalars": 101828,
      "split_limbs": 8402944,
      "total": 41421508
    },
    "lookups": 41311910
  },
  "projection_inputs": {
    "memory": {
      "bytes_per_leaf": 32.0,
      "free_bytes": 200000000000.0
    },
    "regen_full_equivalents": 5.0,
    "scenario": {
      "batch_tokens": 16384,
      "eta": 0.3,
      "gpus": 8,
      "target_overhead": 0.1,
      "violations": 100
    },
    "unit_costs": {
      "column_answer_ps": 0.0,
      "commit_ps": 30.0,
      "glue_fraction": 0.15,
      "lookup_ps": 40.0,
      "native_ops_per_s": 1187400000000000.0,
      "product_leaf_ps": 12.0,
      "streaming_pass_ps": 0.0,
      "weight_pass_gpu_s": 0.24
    }
  },
  "projections": [
    {
      "context": 1024,
      "detection": 0.9534458734893402,
      "mu": {
        "attention": 1.1332044117420268,
        "column_answers": 0.0,
        "linear": 4.845189239610962,
        "regen": 5.0,
        "streaming": 0.0,
        "tables": 0.03569651553488315,
        "total": 11.03540772181004,
        "weights": 0.021317554922167414
      },
      "proof_time_s": 0.9706267699996652,
      "sampling_rate": 0.03020580133840852,
      "streaming_passes": 5
    },
    {
      "context": 4096,
      "detection": 0.9055958283770988,
      "mu": {
        "attention": 4.463433570734373,
        "column_answers": 0.0,
        "linear": 4.7710236751098405,
        "regen": 5.0,
        "streaming": 0.0,
        "tables": 0.03515010710903181,
        "total": 14.29059859894992,
        "weights": 0.020991245996674724
      },
      "proof_time_s": 5.105913651295544,
      "sampling_rate": 0.023325358348377855,
      "streaming_passes": 7
    },
    {
      "context": 16384,
      "detection": 0.7197316533413071,
      "mu": {
        "attention": 16.823652195066106,
        "column_answers": 0.0,
        "linear": 4.495756554480757,
        "regen": 5.0,
        "streaming": 0.0,
        "tables": 0.03312210024245841,
        "total": 26.372310993046337,
        "weights": 0.019780143257011964
      },
      "proof_time_s": 39.99815974593229,
      "sampling_rate": 0.012639519282979196,
      "streaming_passes": 9
    },
    {
      "context": 131072,
      "detection": 0.2952266062235171,
      "mu": {
        "attention": 87.48123888537518,
        "column_answers": 0.0,
        "linear": 2.9221832197378363,
        "regen": 5.0,
        "streaming": 0.0,
        "tables": 0.021528933864205915,
        "total": 95.43780787453072,
        "weights": 0.012856835553527138
      },
      "proof_time_s": 1781.5483284768006,
      "sampling_rate": 0.003492675919081847,
      "streaming_passes": 12
    }
  ],
  "schema": "tessera.commitment-report/1",
  "sequence": {
    "product_tree_leaves": 4128768,
    "scores": 2193408
  },
  "tables": [
    {
      "id": 0,
      "kind": "Rope",
      "lookups_per_token": 0,
      "rows": 8388608,
      "score_lookups": 0
    },
    {
      "id": 1,
      "kind": "Exp",
      "lookups_per_token": 0,
      "rows": 4194304,
      "score_lookups": 2193408
    },
    {
      "id": 2,
      "kind": "Silu",
      "lookups_per_token": 6709248,
      "rows": 536870912,
      "score_lookups": 0
    },
    {
      "id": 3,
      "kind": "Range",
      "lookups_per_token": 2209792,
      "rows": 2097152,
      "score_lookups": 0
    },
    {
      "id": 4,
      "kind": "Requant",
      "lookups_per_token": 16384,
      "rows": 1048576,
      "score_lookups": 0
    },
    {
      "id": 5,
      "kind": "Requant",
      "lookups_per_token": 2193408,
      "rows": 8388608,
      "score_lookups": 0
    },
    {
      "id": 6,
      "kind": "Requant",
      "lookups_per_token": 6838272,
      "rows": 536870912,
      "score_lookups": 0
    },
    {
      "id": 7,
      "kind": "Range",
      "lookups_per_token": 2064384,
      "rows": 1048576,
      "score_lookups": 0
    },
    {
      "id": 8,
      "kind": "Requant",
      "lookups_per_token": 2064384,
      "rows": 1048576,
      "score_lookups": 0
    },
    {
      "id": 9,
      "kind": "Requant",
      "lookups_per_token": 16384,
      "rows": 536870912,
      "score_lookups": 0
    },
    {
      "id": 10,
      "kind": "Range",
      "lookups_per_token": 4128768,
      "rows": 67108864,
      "score_lookups": 0
    },
    {
      "id": 11,
      "kind": "Requant",
      "lookups_per_token": 4128768,
      "rows": 67108864,
      "score_lookups": 0
    },
    {
      "id": 12,
      "kind": "Requant",
      "lookups_per_token": 6709248,
      "rows": 65536,
      "score_lookups": 0
    },
    {
      "id": 13,
      "kind": "Requant",
      "lookups_per_token": 2064384,
      "rows": 2147483648,
      "score_lookups": 0
    },
    {
      "id": 14,
      "kind": "Requant",
      "lookups_per_token": 2048000,
      "rows": 1073741824,
      "score_lookups": 0
    }
  ]
}
